11/25/2019 18:47:02;Tallinna Järveotsa Gümnaasium;Naine;7.-9.;1-5 km;5;2;1;1;1;1;Tal on hommikul raske ärgata ja ühistranspordiga minek võtab kauem aega;2;1;5;1;1;1;1;Tuleb vastavalt tundide lõpuajale nii nagu jõuab;Viin autoga kooli (isegi kui vahel harva), Toon autoga koolist (isegi kui vahel harva);5;;11-20 minutit;Kui lapsed on hommikul väga väsinud;2;2;Ei näe võimalust teda hommikul veel varem äratada, see teeks kõigi elu nutusemaks;31-45 minutit;Kui kool algaks hiljem;5;rohkem kui 60 minutit;4;Reguleerimata ülekäigurajad;4;Ei ole marganud;Lasen lapse välja ja võtan peale koolist eemal majade taga. ;Ei oska oelda;Ei oska öelda;
11/25/2019 19:28:51;Tallinna Järveotsa Gümnaasium;Mees;4.-6.;5-10 km;4;4;1;1;1;1;Kuna sõidame ise hommikul autoga tööle, viime lapse kooli ka autoga. Koolist koju sõidab ise bussiga. Kool on kodust liiga kaugel, et jalgsi tulla. Oleme mõelnud kevad-sügisel perioodil pakkuda kasutamiseks elektritõukeratast või jalgratast.;2;1;1;1;1;1;1;Mugav, bussipeatus on kooli lähedal, väljub bussist kodu juures.;Viin autoga kooli (isegi kui vahel harva);4;Otseselt ohte ei olegi, lihtsalt mugavus.;11-20 minutit;Sest laste kool jääb lapsevanema töö marsruudile (või enamvähem), Kui lapsed on hommikul väga väsinud;3;4;Laps peaks varem ärkama.;21-30 minutit;Kui koolipäev algaks hiljem nt. 8.30-9.00;4;46-60 minutit;4;Reguleerimata ülekäigurajad, Halvasti valgustatud tänavad, Väikesed ohutussaared suure liiklusega teel;4;Seisva bussi kõrvalt kihutavad teisel real ülekäigurajale sõiduautod. Hoolimata sellest, et buss laseb jalakäijad üle tee.;Kooli juurde, kuid mitte ukse ette. Pisut kaugemale seetõttu, et jalgsi liikuvatel lastel oleks turvalisem kooliukseni jõuda, mitte seigelda autode vahel.;Koolis on kindlad reeglid parkimse osas, see on juba suur asi.;Olla ettevaatlik.;Rohekm tänavavalgustust kooli ümbrusesse. Jalgväravast väljudes on pimedal ajal kooli ümbrus väga pime koht, seega hea pinnas laste kiusamiseks või veel hullemaks.
11/25/2019 20:09:28;Tallinna Järveotsa Gümnaasium;Naine;1.-3.;1-5 km;2;1;5;4;1;1;Lapsele meeldib tõuke või tava rattaga kooli minna. Teele kuulub vähem aega kui jalgsi ja laps on energiline. Lihtsalt meeldib niivisi minna.;2;1;1;5;4;1;1;;Ei kasuta lapse transportimiseks autot;4;Võike õismäe peatusest mööda kõndides vajab laps liikumist üle tee seal samas. Just see kõnnitee tekitab mulle kõige enam muret. Kuna autode ja busside liikumine on tihe ja kiire. Mitte kõik autodes raatsivad peatuda.;5-10 minutit;Ei kasuta autot;1;3;Niigi käib;5-10 minutit;Niigi käib;5;rohkem kui 60 minutit;4;Pööret lõpetavad juhid ei anna lastele teed, Väikesed ohutussaared suure liiklusega teel, Ülekäigurajal on parkivate sõidukite tõttu nähtavus piiratud;1;Kooli ees tihti peale istuvad joobes inimesed;Ei;;;
11/25/2019 21:44:47;Tallinna Järveotsa Gümnaasium;Mees;7.-9.;1-5 km;2;4;1;2;1;1;Bussiga mugav ühendus kooli ja kodu vahel. Vajadusel, näiteks äärmiselt kehva ilma korral saab ka autoga viidud.;2;1;5;1;2;1;1;;Viin autoga kooli (isegi kui vahel harva), Toon autoga koolist (isegi kui vahel harva);4;;5-10 minutit;Viime halva ilma korral, Kui oleme hiljaks jäämas, Kui lapsed on hommikul väga väsinud;3;2;Midagi ei muutu, käivadki enamasti iseaeisvalt;11-20 minutit;Ei ole sellega probleeme;4;31-45 minutit;4;Reguleerimata ülekäigurajad;4;Ohtlik tee ületamine;Parkimisalale;Ei;Jätkuvalt täita eeskirju;
11/26/2019 8:20:38;Tallinna Järveotsa Gümnaasium;Naine;4.-6.;1-5 km;1;4;3;2;1;1;Selletõttu, et laps on siiski alles 11 aastane.;2;1;4;3;2;1;1;11 aastastel ei ole juhilube;Ei kasuta lapse transportimiseks autot;4;liiklusõnnetused;5-10 minutit;Viime halva ilma korral;4;4;99 protsenti ajast käib ta ise koolis.;11-20 minutit;Ta on alati nõus olnud;5;rohkem kui 60 minutit;5;Pööret lõpetavad juhid ei anna lastele teed, Suurem oht langeda kuriteo ohvriks, Sõidukijuhid sõidavad tihti punase fooritulega ristmikule, mida lapsed peavad ületama, Ülekäigurajal on parkivate sõidukite tõttu nähtavus piiratud, Paljud täiskasvanud näitavad oma liikluskäitumisega lastele halba eeskuju, Lubatud sõidukiirust ületavad juhid;4;Piiratud nähtavusega kohtades pargivad autod mille tõttu ei näe jalakäijaid ülekäiguradade ääres.;Kooli parklasse kui on võimalus või peatun teel, kooli ees.;kooli asukoha suhtes pole võimalust midagi ette võta.;Ei oska öelda;Antud kooli suhtes on turvalisus tagatud.
11/26/2019 8:47:38;Tallinna Järveotsa Gümnaasium;Mees;1.-3.;1-5 km;4;2;1;1;1;1;Kui ajaliselt sobib, siis viime ta ise kooli, sest siis saab tema ka kauem magada hommikuti ja koolipäevaks välja puhata. ;2;1;4;1;1;1;1;Kuna koolipäev lõpeb tööpäevast erinevalt, siis peab ta ise hakkama saama. ;Viin autoga kooli (isegi kui vahel harva), Toon autoga koolist (isegi kui vahel harva);4;;5-10 minutit;Sest laste kool jääb lapsevanema töö marsruudile (või enamvähem);3;3;Lapse kooli viimine hoiab mind samuti paremini ajagraafikus, sest jõuan selle tõttu varem tööle. Vastasel juhul ei kiirustaks. Lapse kooli viimine ei tekita olulist ajakulu, sest see jääb enam-vähem marsruudile. ;11-20 minutit;On, pole tingimusi. Ta on 1 klassi õpilase kohta üsna iseseisev, alates esimesest koolinädalast. ;4;46-60 minutit;4;Pööret lõpetavad juhid ei anna lastele teed, Sõidukijuhid sõidavad tihti punase fooritulega ristmikule, mida lapsed peavad ületama;2;Liigselt kiirustavad lapsevanemad (autoga) kooli parklas, kus autosid on palju, lapsed liiguvad igal pool. Ka ei ole ühelt poolt kooli liikudes jalgteed. ;Kui tulen, siis sõidan aeglaselt ja jälgin enda ümber toimuvat. Vahel jätan auto eemale. ;Jalgtee rajamine. ;Jah, parkida eemale ja vähendades seega liikluskoormust. ;teoreetiliselt saaks tekitada autodele ringsüsteemi, kus ühest väravast sõidetakse välja, lapse pannakse maha ning liigutakse edasi teiselt poolt välja. Et oleks parklas vähem manööverdamist ja edasi-tagasi sõitmist. 
11/26/2019 9:42:37;Tallinna Järveotsa Gümnaasium;Naine;7.-9.;5-10 km;5;2;2;1;1;1;Elame linnapiirist väljas. Ühistransport väga kehv, jäänud isegi busse tulemata (Atko). Bussipeatusesse tuleb minna valgustamata teed mööda 2 km;2;1;4;4;1;1;1;Kool lõppeb päeval ja vanemad tööl. Laps peab saama ise koju.;Viin autoga kooli (isegi kui vahel harva);4;Tihe liiklus, pime, ummikud;11-20 minutit;Sest laste kool jääb lapsevanema töö marsruudile (või enamvähem), Sest nii on ohutum, Bussipeatusesse 2 km mööda pimedat külateed;4;4;Tuleb koolist koju ise aga kooli viime autoga. Kuni elame linnast väljas ja ühistranspordi olukord ei parane, ei ole muud varianti. Peab hakkama kooli minema poolest ööst kui läheks ise bussiga.;46-60 minutit;On nõus käima ja käiks hea meelega ise ka hommikuti kui bussitransport oleks normaalne;5;rohkem kui 60 minutit;4;Reguleerimata ülekäigurajad, Halvasti valgustatud tänavad, Väikesed ohutussaared suure liiklusega teel, Lubatud sõidukiirust ületavad juhid;2;Majade ja parkivate autode vahel sõidavad autod liiga kiiresti. Väiksemad lapsed, kes auto tagant välja astuvad, võivad ohtu sattuda;Mitte väga kaugel koolist, u 300-400m koolmaja taga. Sest seal on vaiksem liiklus ja lapsel turvalisem koolini jõuda.;;;
11/26/2019 12:43:43;Tallinna Järveotsa Gümnaasium;Naine;7.-9.;Üle 10 km;5;2;1;1;1;1;Sest liigume ise samas suunas.;2;1;5;1;1;1;1;;Viin autoga kooli (isegi kui vahel harva);4;Tihe liiklus;11-20 minutit;Sest laste kool jääb lapsevanema töö marsruudile (või enamvähem);5;5;Kui muutuks marsruut, siis läheks iseseisvalt kooli.;46-60 minutit;On nõus;5;rohkem kui 60 minutit;3;Reguleerimata ülekäigurajad, Halvasti valgustatud tänavad, Pööret lõpetavad juhid ei anna lastele teed, Suurem oht langeda kuriteo ohvriks, Sõidukijuhid sõidavad tihti punase fooritulega ristmikule, mida lapsed peavad ületama, Lubatud sõidukiirust ületavad juhid;1;Tihe liiklus;Tulen autoga ja peatun tänaval;;;
11/26/2019 12:51:14;Tallinna Järveotsa Gümnaasium;Naine;7.-9.;5-10 km;5;1;1;1;1;1;Elame koolist 9 km kaugusel Vatsla külas, kus on väga halb transpordiühendus kooli jõudmiseks.;5;1;2;1;1;1;1;Kodu asub koolist 9 km kaugusel. Kui mõningatel juhtudel on võimalik saada ühistranspordiga osaliselt kodule lähemale, siis 2,2 km tuleb ikkagi jalgsi kõndida.;Viin autoga kooli (isegi kui vahel harva), Toon autoga koolist (isegi kui vahel harva);4;Hommikune ja õhtune tihe liiklus ning umbe pargitud tänavatest tulenev närviline ja ülekoormatud liiklus koolilähedases elamukvartalis Õismäel.  ;11-20 minutit;Sest laste kool jääb lapsevanema töö marsruudile (või enamvähem), Sest puudub normaalne ja liigselt kurnav võimalus kooli minemiseks ühistranspordiga.;1;1;Kahjuks ei ole see võimalik normaalse transpordiühenduse puudumise tõttu. Samas ei muutuks ka midagi minu elus, sest minu tööteekond autoga jääb samaks.;46-60 minutit;Normaalsema transpordiühenduse olemasolul ja kooli lähemal asumisel (hetkel vahemaa 9 km).;5;46-60 minutit;2;Reguleerimata ülekäigurajad, Halvasti valgustatud tänavad, Väikesed ohutussaared suure liiklusega teel, Suurem oht langeda kuriteo ohvriks, Sõidukijuhid sõidavad tihti punase fooritulega ristmikule, mida lapsed peavad ületama, Ülekäigurajal on parkivate sõidukite tõttu nähtavus piiratud, Paljud täiskasvanud näitavad oma liikluskäitumisega lastele halba eeskuju, Lubatud sõidukiirust ületavad juhid;1;Õuealas teed mitteandvad juhid, kiiruse ületajad, teed mitteandvad juhid, ülbed ja liikluseeskirju rikkuvad kiirustavad juhid.;Saabun autoga, väldin teisi kiirustavaid ja liikluseeskirju rikkuvaid juhte, leian turvalise ja teisi liiklejaid mittesegava peatumiskoha lapse turvaliseks sõidukist väljumiseks kooli läheduses.;Piirama füüsiliselt lapsi kooli sõidutavate vanemate sõitmise kooli ukse ette eirates mitmeid sissesõidu keelumärke ja pannes ohtu jalgsi kooli tulevaid lapsi kooli territooriumil.;Jah, leida lapse sõidukist väljumiseks hõredama liiklusega koha.;Kooli saabuval teel liikluskorralduse muutmist.
11/26/2019 14:15:11;Tallinna Järveotsa Gümnaasium;Mees;1.-3.;Kuni 1 km;2;1;2;4;1;1;Et laps saaks liikuda piisavalt.;2;1;2;2;4;1;1;;Viin autoga kooli (isegi kui vahel harva), Toon autoga koolist (isegi kui vahel harva);5;;5-10 minutit;Viime halva ilma korral;5;5;Laps käib iseseivalt 99% ajast ise kooli ja koju.;21-30 minutit;Laps liigub iseseisvalt;4;rohkem kui 60 minutit;4;Reguleerimata ülekäigurajad;2;Ei ole täheldanud;Ei sõida autoga;;;
11/26/2019 14:19:20;Tallinna Järveotsa Gümnaasium;Naine;1.-3.;Kuni 1 km;2;1;4;1;1;1;*;2;1;1;4;1;1;1;*;Viin autoga kooli (isegi kui vahel harva), Toon autoga koolist (isegi kui vahel harva), Ei kasuta lapse transportimiseks autot;4;autod ja võõrad inimesed;alla 5 minuti;Sest laste kool jääb lapsevanema töö marsruudile (või enamvähem);1;1;ta käib iseseisvalt;5-10 minutit;siis, kui kõi pedofiilid on vanglas.;2;rohkem kui 60 minutit;4;Reguleerimata ülekäigurajad, Halvasti valgustatud tänavad, Pööret lõpetavad juhid ei anna lastele teed, Suurem oht langeda kuriteo ohvriks, Sõidukijuhid sõidavad tihti punase fooritulega ristmikule, mida lapsed peavad ületama, Ülekäigurajal on parkivate sõidukite tõttu nähtavus piiratud, Paljud täiskasvanud näitavad oma liikluskäitumisega lastele halba eeskuju, Lubatud sõidukiirust ületavad juhid;5;kui laps läheb autode vahel, siis teda ei ole näha;;;;
11/26/2019 14:24:33;Tallinna Järveotsa Gümnaasium;Naine;1.-3.;Kuni 1 km;1;1;2;4;1;1;Tõukerattaga jõuab kiiremini kui jala;1;1;1;2;4;1;1;kiirem ja muagavam;Ei kasuta lapse transportimiseks autot;3;ei vii last autoga kooli, m iks ma pean järgenvatele vastama??;rohkem kui 60 minutit;Viime halva ilma korral, Sest laste kool jääb lapsevanema töö marsruudile (või enamvähem), Kui lapsed paluvad, Kui oleme hiljaks jäämas, Kui lapsed on hommikul väga väsinud, Viime, selleks, et see aitab meil oma (lapsevanema) päeva rutiini hoida, Viime ühistranspordi peatuseni, sest sinna on pikk maa, Viime ühistranspordi peatuseni, sest tee sinna on muidu ohtlik., Sest nii on ohutum, ei vii last autoga kooli, aga märkisin kõik kuna te ei näinud sellist varianti ette;4;3;ta juba käibki, seega midagi ei muutu;5-10 minutit;ta tahabki ise käia;4;31-45 minutit;4;Suurem oht langeda kuriteo ohvriks, Paljud täiskasvanud näitavad oma liikluskäitumisega lastele halba eeskuju, harv liiklus võib põhjustada hooletust liikluskäitumises;5;Kooli hoovis sõidavad autod mõnikord mitte piisavalt tähelepanelikult ja liiga kiiresti;Jalgsi;mitte lubada lapsevanemaid ja muid külastajaid kooli hoovi autoga;vist mitte;
11/26/2019 14:40:08;Tallinna Järveotsa Gümnaasium;Naine;1.-3.;Kuni 1 km;1;1;5;3;1;1;Kool asub kodu lähedal, seele pärast jalgsi, kevafeti ja sügisel mõnikord tõukerattaga, lapse omal soovil.;1;1;1;5;3;1;1;;Ei kasuta lapse transportimiseks autot;4;Tuleb ületada autotee, kuigi majade juures.;alla 5 minuti;Viime halva ilma korral;1;3;Midagi;5-10 minutit;Elame kooli kõrval ja käib jala iseseisvalt;5;rohkem kui 60 minutit;4;Reguleerimata ülekäigurajad, Halvasti valgustatud tänavad;3;Sõitvad autod;Jalgsi;Jah, ei lubata autodega kooli ette sõita kooli tundide ajal.;Ei;
11/26/2019 14:46:38;Tallinna Järveotsa Gümnaasium;Naine;4.-6.;Kuni 1 km;1;1;5;3;1;1;Lapse soovil tõukerattaga kevadel ja sügisel, nii on veel kiirem, kui jalgsi;1;1;1;5;3;1;1;;Ei kasuta lapse transportimiseks autot;4;Sõitvad autod;alla 5 minuti;Viime halva ilma korral;1;3;Midagi, niigi käivad ise jalgsi;5-10 minutit;Pole valimut, käivaf ise, kool on lähexal;5;rohkem kui 60 minutit;4;Reguleerimata ülekäigurajad, Halvasti valgustatud tänavad;3;Sõitvad autod;Jalgsi;Ei luba autodel kooli territooriumile sõita koolitundide ajal;Ei;
11/26/2019 15:36:34;Tallinna Järveotsa Gümnaasium;Mees;7.-9.;Üle 10 km;1;5;1;1;1;1;Sellepärast, et kool asub kodust 20 km kaugusel.;1;1;5;1;1;1;1;;Ei kasuta lapse transportimiseks autot;;;31-45 minutit;Viime ühistranspordi peatuseni, sest tee sinna on muidu ohtlik.;5;4;Laps käibki ise koollis;rohkem kui 60 minutit;Laps käib üksi ise juba koolis;5;rohkem kui 60 minutit;3;Paljud täiskasvanud näitavad oma liikluskäitumisega lastele halba eeskuju;4;Pole märganud;Harva käin;;;
11/26/2019 16:38:08;Tallinna Järveotsa Gümnaasium;Naine;1.-3.;Kuni 1 km;1;1;5;1;1;1;Kool on lähedal;1;1;1;5;1;1;1;;Ei kasuta lapse transportimiseks autot;5;;alla 5 minuti;ei vii autoga kooli;3;5;Minu laps käib kooli iseseisvalt;11-20 minutit;Ta käib ise;4;31-45 minutit;3;Reguleerimata ülekäigurajad, Pööret lõpetavad juhid ei anna lastele teed, Ülekäigurajal on parkivate sõidukite tõttu nähtavus piiratud, Paljud täiskasvanud näitavad oma liikluskäitumisega lastele halba eeskuju, Teised autod, kes pidevalt sõidavad maja parklast üle ülekäiguraja, vaatamata sellele, et seal inimesed.;1;Autod sõidavad liiga kiirest maja vahel.;Jalgsi;panna valgusfoori;;
11/26/2019 16:45:37;Tallinna Järveotsa Gümnaasium;Naine;1.-3.;Kuni 1 km;1;1;5;1;1;1;Koolini jalgsi on 300m, autoga um.2km.;1;1;1;5;1;1;1;;Ei kasuta lapse transportimiseks autot;3;Teiste vanemate autod;5-10 minutit;Ei vii autoga;3;5;Midagi;5-10 minutit;Temal valikut pole, käib iseseisvalt jalgsi;4;rohkem kui 60 minutit;3;Reguleerimata ülekäigurajad, Lubatud sõidukiirust ületavad juhid;5;-;;Kool midagi ei saa teha;Ei;
11/26/2019 18:30:10;Tallinna Järveotsa Gümnaasium;Mees;1.-3.;Kuni 1 km;1;1;5;3;1;1;Kõige sobivam;1;1;1;5;3;1;1;;Ei kasuta lapse transportimiseks autot;5;;5-10 minutit;Käib jalgsi kooli;4;3;Ei;5-10 minutit;Ei;4;5-10 minutit;5;Minu arvates ei ole lapsel kooliteel mingeid ohte;3;Ei näinud;Jalgsi;Ei;Ei;
11/26/2019 19:15:02;Tallinna Järveotsa Gümnaasium;Naine;7.-9.;5-10 km;2;4;3;1;1;1;me ei oma lube;1;1;4;2;2;1;1;;Viin autoga kooli (isegi kui vahel harva);4;Aeg ajalt on hommikuti kiire ja kaas liiklejad on närvilised ja ettevaatamatud.;5-10 minutit;Viime halva ilma korral, Kui oleme hiljaks jäämas, Kui lapsed on hommikul väga väsinud;3;3;Ta käibki iseseisvalt;11-20 minutit;ta käib piisavalt juba;5;46-60 minutit;4;Reguleerimata ülekäigurajad, Halvasti valgustatud tänavad, Pööret lõpetavad juhid ei anna lastele teed, Sõidukijuhid sõidavad tihti punase fooritulega ristmikule, mida lapsed peavad ületama, Paljud täiskasvanud näitavad oma liikluskäitumisega lastele halba eeskuju, Lubatud sõidukiirust ületavad juhid;1;Kui vanemad toovad lapsi kooli tihti on neil kiire kooli alal ja nad ei märka teisi jala liiklevaid lapsi kooli ees alal.;mina liiklen seal alati jala kuna käin ka ühistranspordiga ;Et autodega ei sõidetaks kooli ette .;Ei sõida autoga kooli juurde. ;
11/26/2019 19:40:49;Tallinna Järveotsa Gümnaasium;Mees;4.-6.;1-5 km;3;3;2;4;1;1;Rattaga on kõige kiirem ja mugavam. Kui rattaga ei saa minna (ratas katki, libedus, lumi), siis viime autoga või läheb bussiga ja jala . Tagasi tuleb bussiga ja jala. Ainult bussiga ei käi, kuna peab ümber istuma ja siis jala juba kiirem. ;1;1;3;3;4;1;1;;Viin autoga kooli (isegi kui vahel harva);5;;alla 5 minuti;Viime halva ilma korral;5;5;Käibki. Ainult talvel viime autoga. Ja seda ka mitte igakord. ;21-30 minutit;Käibki iseseisvalt ;5;rohkem kui 60 minutit;4;Reguleerimata ülekäigurajad, Paljud täiskasvanud näitavad oma liikluskäitumisega lastele halba eeskuju, Lubatud sõidukiirust ületavad juhid, Ülekäigurajal ei anna autojuhid teed. Kui ta esimeses klassis käis, siis ühe ettevõtte auto pidi ta minu silme all ülekäigurajal alla ajama. a;5;"Minu laps nutitelefonis ei tohi olla, ega olegi, aga koolikaaslased on. Mitu korda olen tähele pannud ohtlikke teeületusi lastel. 
";Liigun ise tavaliselt jala ja bussiga. ;Kool on sisehoovis. Autoga hoovi sõita ei soovitata. ;Ei sõida autoga kooli juurde. ;
11/26/2019 20:13:30;Tallinna Järveotsa Gümnaasium;Naine;1.-3.;1-5 km;2;4;1;1;1;1;Sest buss läheb maja eest otse koolini;2;1;5;1;1;1;1;Bussiga mugav,kuna viib maja ette;Viin autoga kooli (isegi kui vahel harva), Toon autoga koolist (isegi kui vahel harva);4;;5-10 minutit;Viime halva ilma korral;5;5;Laps käib ise ja tuleb ise;11-20 minutit;Käib iseseisvalt;3;11-20 minutit;4;Reguleerimata ülekäigurajad, Pööret lõpetavad juhid ei anna lastele teed, Sõidukijuhid sõidavad tihti punase fooritulega ristmikule, mida lapsed peavad ületama;3;Autojuhid ei jää seisma ;Jätame auto koolist eemale;;;Lapsevanemad ei peaks sõitma autoga kooli ukse ett2
11/26/2019 21:19:00;Tallinna Järveotsa Gümnaasium;Mees;1.-3.;Kuni 1 km;2;2;4;1;1;1;Eelistaks, et läheb bussiga, kuid julgeb bussiga minna ainult siis, kui läheme koos. Ise liigub jalgsi.;1;1;1;5;1;1;1;Kõige mõistlikum on liigelda jalgsi koju.;Viin autoga kooli (isegi kui vahel harva);3;Kooli juures teised autod on eriti ohtlik tegur.;alla 5 minuti;Sest laste kool jääb lapsevanema töö marsruudile (või enamvähem);3;3;Mitte midagi ei muutuks. Sõidame autoga kooli juurde siis, kui perepea autoga tööle läheb. Kõige pisema lasteaed asub otse kooli kõrval, seega täiesti üks tee, samuti täiesti tööle mineku tee peal.;11-20 minutit;Käib niigi ise, eelistab ise jalgsi minekut ja tulekut.;3;31-45 minutit;2;Reguleerimata ülekäigurajad, Halvasti valgustatud tänavad, Pööret lõpetavad juhid ei anna lastele teed, Ülekäigurajal on parkivate sõidukite tõttu nähtavus piiratud, Paljud täiskasvanud näitavad oma liikluskäitumisega lastele halba eeskuju, Lubatud sõidukiirust ületavad juhid;5;Autod.;Kui tuleme autoga, peatume kaugemal ning laps läheb ise kooli.;Viipekaardiga tõkkepuu töötajatele, paljud sõidavad keelust ja keelumärgist hoolimata kooli hoovi või lausa ukse ette.;Liigelda ohutult.;Tõkkepuust isegi piisaks.
11/26/2019 21:31:49;Tallinna Järveotsa Gümnaasium;Naine;1.-3.;1-5 km;5;1;1;1;1;1;Kool jääb tee peale, selat edasi tööle;1;1;4;2;1;1;1;;Viin autoga kooli (isegi kui vahel harva);5;;5-10 minutit;Sest laste kool jääb lapsevanema töö marsruudile (või enamvähem);3;3;Midagi;21-30 minutit;Ei oska vastata;5;rohkem kui 60 minutit;1;Reguleerimata ülekäigurajad, Halvasti valgustatud tänavad, Pööret lõpetavad juhid ei anna lastele teed, Väikesed ohutussaared suure liiklusega teel, Ülekäigurajal on parkivate sõidukite tõttu nähtavus piiratud, Paljud täiskasvanud näitavad oma liikluskäitumisega lastele halba eeskuju, Lubatud sõidukiirust ületavad juhid;5;Ei anta lastele teed;Pargin kaupluse parklasse ja sealt minut jala;;;
11/26/2019 21:52:17;Tallinna Järveotsa Gümnaasium;Mees;7.-9.;1-5 km;1;1;5;2;1;1;Jalgsi saab kõige kiireminija on tervisele samuti kasulik;1;1;1;5;2;1;1;Kool on kodule piisavalt lähedal, et koju jalutada.;Ei kasuta lapse transportimiseks autot;1;;alla 5 minuti;Kui oleme hiljaks jäämas;5;5;Ta käibki iseseisvalt koolis;11-20 minutit;Ta käibki jala ja onsellega igati nõus;5;46-60 minutit;3;Reguleerimata ülekäigurajad, Halvasti valgustatud tänavad, Kõnnitee puudub osaliselt, väga ohtlik. ;4;Autod ja jalakäiad liiklevad samal ala.....;Olen korralik liikleja;Kõnniteed puudulikud;;
11/26/2019 22:53:33;Tallinna Järveotsa Gümnaasium;Mees;4.-6.;Üle 10 km;5;1;1;1;1;1;sõidan ise linna tööle ja toon lapse kooli;3;1;2;1;1;1;1;;Viin autoga kooli (isegi kui vahel harva), Toon autoga koolist (isegi kui vahel harva);4;libe tee, loomad teel, lahtiajamata tee;21-30 minutit;Sest laste kool jääb lapsevanema töö marsruudile (või enamvähem);2;2;sõidan ise linna tööle miks peaks laps bussiga minema;46-60 minutit;siis kui elaks linnas;4;46-60 minutit;4;Halvasti valgustatud tänavad, Minu arvates ei ole lapsel kooliteel mingeid ohte;4;ei ole näinud;tuleme kaugelt ja kipume hilinema seega sõidan kooli ette;kõik on hästi;mitte kooli ette sõita;sõidukiirus olgu väike mis peabki selles piirkonnas olema
11/27/2019 9:27:11;Tallinna Järveotsa Gümnaasium;Naine;7.-9.;1-5 km;2;3;3;1;1;1;Ise otsustas;1;1;3;3;1;1;1;;Toon autoga koolist (isegi kui vahel harva);4;Ummik kooli juures;5-10 minutit;Kui lapsed paluvad, Kui oleme hiljaks jäämas;5;5;Midagi;5-10 minutit;Juba kàib;5;31-45 minutit;4;Reguleerimata ülekäigurajad, Pööret lõpetavad juhid ei anna lastele teed, Ülekäigurajal on parkivate sõidukite tõttu nähtavus piiratud, Paljud täiskasvanud näitavad oma liikluskäitumisega lastele halba eeskuju, Lubatud sõidukiirust ületavad juhid;5;Avariid;Vahel harva, peatin koolist eemal, mitte kooli hoovis;;;
11/27/2019 9:28:29;Tallinna Järveotsa Gümnaasium;Naine;4.-6.;1-5 km;3;3;1;1;1;1;Viin lapse kooli kui hommiku lähen varem tööle, kui ei lähe siis sõidab ise bussiga.;1;1;5;1;1;1;1;;Viin autoga kooli (isegi kui vahel harva), Toon autoga koolist (isegi kui vahel harva);5;;5-10 minutit;Sest laste kool jääb lapsevanema töö marsruudile (või enamvähem);3;3;Mitte midagi ei muutuks, lapsele meeldib bussiga ka käia.;21-30 minutit;Ta on nagunii nõus, lihtsalt kuna väljume kodust sama aeg ja ta jääb mulle teepeale siis enamus ajast viin ta autoga;5;46-60 minutit;5;Halvasti valgustatud tänavad;4;lapsed jooksevad ülekäigurajale.;Poe parklasse, mugavusest.;Ei;Ei;
11/27/2019 13:07:24;Tallinna Järveotsa Gümnaasium;Naine;7.-9.;5-10 km;2;5;1;1;1;1;Bussiga on mugav ja saab kiiresti kooli;2;2;5;1;1;1;1;Laps saab iseseisvalt sõita;Toon autoga koolist (isegi kui vahel harva);4;Liiklus teedek, teised autojuhid;11-20 minutit;Viime halva ilma korral, Kui oleme hiljaks jäämas;5;5;Niigi käib;21-30 minutit;Niigi käib iga päev;4;46-60 minutit;4;Reguleerimata ülekäigurajad, Halvasti valgustatud tänavad, Pööret lõpetavad juhid ei anna lastele teed, Sõidukijuhid sõidavad tihti punase fooritulega ristmikule, mida lapsed peavad ületama, Ülekäigurajal on parkivate sõidukite tõttu nähtavus piiratud, Paljud täiskasvanud näitavad oma liikluskäitumisega lastele halba eeskuju, Lubatud sõidukiirust ületavad juhid;5;Ei ole tähele pannud;Tulen autoga väga harva, pargin kooli tagumise parklasse;;;
11/27/2019 19:40:07;Tallinna Järveotsa Gümnaasium;Naine;4.-6.;1-5 km;3;3;1;1;1;1;teistmoodi ei ole võimalik, puuduvad kõnniteed.;3;1;3;1;1;1;1;;Viin autoga kooli (isegi kui vahel harva), Toon autoga koolist (isegi kui vahel harva);4;ummikud;5-10 minutit;Viime halva ilma korral, Kui lapsed paluvad, Kui lapsed on hommikul väga väsinud, Sest nii on ohutum;3;3;tekitaks rohkem muret;21-30 minutit;kui infrasuktuur oleks rohkem arenenud;4;31-45 minutit;3;Reguleerimata ülekäigurajad, Halvasti valgustatud tänavad, Suurem oht langeda kuriteo ohvriks, Ülekäigurajal on parkivate sõidukite tõttu nähtavus piiratud, Paljud täiskasvanud näitavad oma liikluskäitumisega lastele halba eeskuju, Lubatud sõidukiirust ületavad juhid;3;koolihoovi sõitvad autojuhid;tänavale, enne kooli väravat;ei tea;ei tea;
11/27/2019 21:29:22;Tallinna Järveotsa Gümnaasium;Mees;7.-9.;Kuni 1 km;1;1;5;1;1;1;Sest elame väga lähedal koolile.;1;1;1;5;1;1;1;;Ei kasuta lapse transportimiseks autot;;;alla 5 minuti;Ei vii autoga kooli, sest kool on väga lähedal.;5;3;Laps käib niigi jala koolis.;alla 5 minuti;Laps käib niigi iseseisvalt koolis.;4;rohkem kui 60 minutit;4;Reguleerimata ülekäigurajad;5;Ühel pool kooli aeda pargitud autod piiravad nähtavust.;Jalgsi;;Lisada ülekäike.;
11/27/2019 21:50:03;Tallinna Järveotsa Gümnaasium;Mees;7.-9.;Kuni 1 km;1;1;5;1;1;1;Kool on 500 meetri kaugusel, jala on mugavaim viis kohale jõuda;1;1;1;5;1;1;1;;Ei kasuta lapse transportimiseks autot;;;alla 5 minuti;ei vii last autoga kooli;4;4;Jalgsi kooli minek on kasulik tervisele ja ei saasta loodust;5-10 minutit;iga päev käib ise jala koolis, millist enamat iseseisvust pean tahtma? Täiesti valesti koostatud küsimustik!;4;rohkem kui 60 minutit;4;Lubatud sõidukiirust ületavad juhid;4;elamurajoonis ei peeta 20 km/h kiiruse reeglist lugu;Ei sõida autoga;;;
